name,url,category,fairness_bias_mentioned,how_fairness,data_privacy,how_data_privacy,transparency_mentioned,how_transparency,data_explainability,how_explainability,post_competition_model_use,how_model_use,toy,how_toy,red_team,how_red_team
KBA Challenge 2019,https://www.kaggle.com/competitions/kba2019,business,no,n/a,no,n/a,no,n/a,no,n/a - RMSE,no,n/a,yes,"The competition awards 'Kudos' and 'Does not award Points or Medals', indicating it is for practice and learning rather than a serious deployment challenge.",no,n/a
Data Science - French Actuary Institute,https://www.kaggle.com/competitions/data-science-french-actuary-institute,insurance,no,n/a,no,n/a,no,n/a,no,n/a - Root Mean Squared Error,no,n/a,yes,"The competition prize is listed as 'Knowledge' and it 'Does not award Points or Medals', indicating it is for educational or practice purposes rather than a production-focused challenge.",no,n/a
Workshop Data Science,https://www.kaggle.com/competitions/workshopds,retail,no,n/a,yes,The data description states that several fields were anonymized to protect privacy. Quote: 'User_ID - an anonymous id unique to a given customer... Ocupation - ocupation anonymoused City_category - city category anonymoused'.,yes,"The rules encourage open sharing of code among all participants, which promotes transparency. Quote: 'It's okay to share code if made available to all participants on the forums.'",no,n/a - RMSLE,no,n/a,yes,The competition is explicitly for educational purposes and offers no significant rewards. Quote: 'Limited to data science workshop participants' and 'Does not award Points or Medals'.,no,n/a
BizInnovate 2023,https://www.kaggle.com/competitions/bizinnovate-2023,environmental,no,n/a,yes,"The data description notes a step taken to protect individuals: ""Note that the geocoordinates may not be exact, as they may have been “jittered” randomly up to 2km for urban clusters and 10km for rural clusters to protect survey participant privacy.""",yes,"The rules mandate reproducibility and code submission: ""Your submission must be fully reproducible by the contest organizers...You will also need to send your source code...to admin@pca2023.com.""",no,n/a - r2,yes,"The rules require the winner to license their submission for future use: ""You hereby license and will license your winning Submission and the source code used to generate the Submission under an Open Source Initiative-approved license...that in no event limits commercial use...""",yes,"The competition does not award significant prizes, indicating a focus on learning: ""Prizes & Awards. Kudos. Does not award Points or Medals""",no,n/a
Data Science - MASTER EN BIG DATA ANALYTICS,https://www.kaggle.com/competitions/data-science-master-en-big-data-analytics,transportation,no,n/a,no,n/a,yes,"RESUMEN: se debe entregar una explicación de la(s) propuesta(s) (5 puntos). The competition requires participants to submit a written explanation of their proposed solution(s), which contributes to methodological transparency.",no,n/a - MAE,yes,"Resuelto el desafío, crear una aplicación para un usuario o para la misma empresa sería inmediato y sobretodo muy útil. This states that once the challenge is solved, creating a useful application for the company would be an immediate next step.",yes,"MÁSTER EN BIG DATA ANALYTICS... La nota (de 0 a 10 puntos) se calculará a partir de... The competition is part of a Master's program, is graded, and does not award prizes, indicating its educational purpose.",no,n/a
Data Science Summer2 Osaka,https://www.kaggle.com/competitions/data-science-summer2-osaka,media,no,n/a,no,n/a,yes,The competition encourages sharing solutions by asking participants to make their notebooks public. Quote: '是非ともコンペ終了後にNotebookの公開設定をPublicにしましょう。たとえ小さくても知見を公開して、Kaggleコミュニティ全体に貢献しましょう。' (Let's make the Notebook public after the competition ends...),no,n/a - RMSE,yes,"The competition concludes with a presentation of the top solutions. Quote: '最終発表・上位者の表彰およびソリューション発表' (Final announcement, awards for top performers, and solution presentations).",yes,The competition is described as a study hackathon for beginners and does not award official points or medals. Quote: 'This competition is a study hackathon for the local data science community in Japan...初心者の方こそ是非とも積極的にご参加ください！',no,n/a
Group Project,https://www.kaggle.com/competitions/shbigb-7311,business,no,n/a,no,n/a,no,n/a,no,n/a - Mean F1-Score,no,n/a,yes,"The competition is linked to a course and offers no significant prizes, indicating an educational purpose. Quote: 'You have a dataset (provided on the course NYU classes site)...' and 'Prizes & Awards Kudos Does not award Points or Medals'.",no,n/a
Classification of English Learner Proficiency,https://www.kaggle.com/competitions/celp,education,no,n/a,no,n/a,yes,"The text explains the origin of the dataset, stating: ""The data provided in this challenge comes from an extraction of a past scientific competition.""",no,n/a - Classification Accuracy,no,n/a,yes,"The competition is for practice as it offers no significant rewards: ""Prizes & Awards Kudos Does not award Points or Medals"".",no,n/a
HSU Data Science Challenge SS23,https://www.kaggle.com/competitions/hsu-data-science-ss23-challenge,mechanical engineering,no,n/a,no,n/a,yes,"The origin of the data is stated, and the evaluation metric is clearly defined with its formula. Quote: ""you will work together in groups of two on the NASA bearing dataset...Your results file will be evaluated via the F1-score metric.""",no,n/a - F1-score,no,n/a,yes,"The competition is explicitly for a university course and offers no prizes, indicating an educational purpose. Quote: ""Welcome to the HSU Data Science Challenge, for the course 'Programming and Computational Methods of Data Science'...Does not award Points or Medals""",no,n/a
CareerCon 2019 - Help Navigate Robots ,https://www.kaggle.com/competitions/career-con-2019,robotics,no,n/a,yes,"The rules discuss secure handling of the competition data: ""You agree to use reasonable and suitable measures to prevent persons who have not formally agreed to these Rules from gaining access to the Competition Data.""",yes,"The data origin is explained: ""The data for this competition has been collected by Heikki Huttunen and Francesco Lomio from the Department of Signal Processing...both from Tampere University, Finland.""",no,n/a - Multiclass Accuracy,no,n/a,yes,"The competition is described as educational and for practice: ""CareerCon is a digital event all about landing your first data science job...Ahead of the event, we have a fun competition to get you started."" Prizes are swag, not monetary.",no,n/a
Data Science Lab - Spring 2023,https://www.kaggle.com/competitions/data-science-lab-spring-2023,education,no,n/a,yes,The competition states that features are anonymized: 'The meanings of the features were not revealed by the data provider for privacy reasons.',yes,"The competition encourages reproducibility to ensure transparency in methods: 'Setting a random seed (e.g., SEED=42) will allow for reproducibility.'",no,n/a - AUC,yes,The competition results are used for academic assessment: 'The Kaggle Competition final grade (Private LB position + report) counts for 20% of the grade.',yes,"The competition is part of a university course and is for a grade, not a commercial application: 'Welcome to the UT ECE460J Spring 2023 Kaggle Competition!'",no,n/a
Библиотеки для DS2 - 803,https://www.kaggle.com/competitions/ds803,finance,no,n/a,no,n/a,no,n/a,no,n/a - F1,no,n/a,yes,"The competition does not award points or medals, indicating it is for educational or practice purposes rather than a high-stakes challenge. Quote: 'Does not award Points or Medals'",no,n/a
Practical Innovative Analytics Data Science 2023,https://www.kaggle.com/competitions/practical-innovative-data-science-2023,computer vision,no,n/a,no,n/a,no,n/a,no,n/a - macro F1 score,no,n/a,yes,"The competition does not offer significant prizes, points, or medals, suggesting it is for practice or educational purposes. Quote: 'Prizes & Awards Kudos Does not award Points or Medals'",no,n/a
Machine Learning Competition,https://www.kaggle.com/competitions/ids-2021-ut-course,finance,no,n/a,no,n/a,yes,The competition provides a link to the original data source for details on the data attributes. Quote: 'More information about the attributes of data can be found https://archive.ics.uci.edu/ml/datasets/bank+marketing#.',no,n/a - AUC,no,n/a,yes,The competition is framed as an educational exercise for a course and does not offer points or medals. Quote: 'This is the right time to apply everything you have learned so far... Prizes & Awards Kudos Does not award Points or Medals',no,n/a
Data Science: Asset Price Prediction,https://www.kaggle.com/competitions/ss3-final-ds-asset-price-prediction,finance,no,n/a,no,n/a,yes,"The evaluation process is explained: ""ข้อมูล test 50% จะวัดผลใน Public Leaderboard มีวัตถุประสงค์เพื่อใช้พัฒนา model...ข้อมูล test อีก 50% จะวัดผลใน Private Leaderboard...จะใช้ Metric: Mean Absolute Percentage Error (MAPE)""",no,n/a - Mean Absolute Percentage Error (MAPE),no,n/a,yes,The competition is for assessment or practice as it is part of a 'Hackathon Individual Test' and the prize section states it 'Does not award Points or Medals'.,no,n/a
SSSSO Khammam Medchal Competition,https://www.kaggle.com/competitions/sssso-kmm-mdcl-competition,telecommunications,no,n/a,no,n/a,yes,"The evaluation process is explained: 'The evaluation metric for this competition is Mean F1-Score. The F1 score, commonly used in information retrieval, measures accuracy using the statistics precision p and recall r.'",no,n/a - Mean F1-Score,no,n/a,yes,The competition is part of a training program and offers no significant prizes: 'Welcome to the final leg of your training program.' and 'Does not award Points or Medals'.,no,n/a
Flavours of Physics: Finding τ  →  μμμ,https://www.kaggle.com/competitions/flavours-of-physics,physics,yes,"The metric includes checks to ensure unbiased results. ""The metric used in this challenge includes checks that physicists do in their analysis to make sure the results are unbiased.""",no,n/a,yes,"The competition provides GitHub links to the implementation of its custom evaluation checks. ""Please check out the github repo to learn more about how the agreement test is implemented.""",no,n/a - Weighted Area Under the ROC Curve,yes,"There is a specific award for the model most useful for the experiment, with criteria including production suitability. ""An award will be given to the team that... creates a model that is most useful for the LHCb experiment... The suitability for use in production""",no,n/a,no,n/a
Human Activity Recognition Using Smartphones Data Set,https://www.kaggle.com/competitions/human-activity-recognition-using-smartphones-data-set,healthcare,no,n/a,no,n/a,yes,"The competition provides detailed information about the data features in separate files, promoting transparency. Quote: ""If you want to have the names of the features, please take a look at the files 'feature_label.txt' and 'features.txt'.""",no,n/a - categorization accuracy,no,n/a,yes,"The competition is framed as an educational exercise with no significant prize. Quote: ""With the in-class competition you will get another chance to sharpen your prediction skills."" and ""Prizes & Awards: Knowledge. Does not award Points or Medals""",no,n/a
Tweet Sentiment Extraction,https://www.kaggle.com/competitions/tweet-sentiment-extraction,internet,no,n/a,no,n/a,yes,"The source of the dataset is explained and licensed: 'The dataset is titled Sentiment Analysis: Emotion in Text tweets with existing sentiment labels, used here under creative commons attribution 4.0. international licence.'",no,n/a - word-level Jaccard score,yes,Winning solutions must be licensed under an open source license 'that in no event limits commercial use of such code or model containing or depending on such code.',no,n/a,no,n/a
MBI Big Data & Data Science Competition,https://www.kaggle.com/competitions/mbi2022Cup,automotive,no,n/a,no,n/a,yes,The creation of the dataset is explained: 'I built a scraper for a school project and expanded upon it later to create this dataset which includes every used vehicle entry within the United States on Craigslist.',no,n/a - RMSE,no,n/a,yes,"The competition is described as originating from a 'school project' and it 'Does not award Points or Medals', which indicates it's for learning or practice.",no,n/a
